{
  "version": "0.2.0",
  "versionCode": 200,
  "minimumVersionCode": 2,
  "forceUpdate": false,
  "publishedAt": "2026-07-22T07:11:40Z",
  "downloadUrl": "https://github.com/dahsameer/litter/releases/download/v0.2.0/litter_0.2.0.apk",
  "apkSize": 2549936,
  "releaseNotes": "fixed self updater\r\nfixed release build\r\nrestructured settings page",
  "sha256": "3fb33f2ad23aceadcb34f5c0185277622a97ddc3978b2cd8bae0a649902a178f"
}
